pmid,issn,name,year,doi,pmcid,title
10359080,0014-5793,FEBS Lett.,1999,,,A novel plant nuclear gene encoding chloroplast ribosomal protein S9 has a transit peptide related to that of rice chloroplast ribosomal protein L12.
12006626,0021-9533,J. Cell. Sci.,2002,,,The plant Spc98p homologue colocalizes with gamma-tubulin at microtubule nucleation sites and is required for microtubule nucleation.
16230331,0032-0781,Plant Cell Physiol.,2005,10.1093/pcp/pci215,,OsGAP1 functions as a positive regulator of OsRab11-mediated TGN to PM or vacuole trafficking.
16249326,0032-0781,Plant Cell Physiol.,2006,10.1093/pcp/pci220,,"Molecular cloning, functional expression and subcellular localization of two putative vacuolar voltage-gated chloride channels in rice (Oryza sativa L.)."
16581873,0032-0889,Plant Physiol.,2006,10.1104/pp.106.079533,PMC1459324,Identification of a vacuolar sucrose transporter in barley and Arabidopsis mesophyll cells by a tonoplast proteomic approach.
19142958,1615-9861,Proteomics,2009,10.1002/pmic.200800323,,In vivo phosphorylation sites of barley tonoplast proteins identified by a phosphoproteomic approach.
16649109,0167-4412,Plant Mol. Biol.,2006,10.1007/s11103-005-5548-x,,The highly charged region of plant beta-type phosphatidylinositol 4-kinase is involved in membrane targeting and phospholipid binding.
16667159,0032-0889,Plant Physiol.,1989,,PMC1062098,Effects of cold-treatment on protein synthesis and mRNA levels in rice leaves.
16699542,1001-0602,Cell Res.,2006,10.1038/sj.cr.7310058,,MORN motifs in plant PIPKs are involved in the regulation of subcellular localization and phospholipid binding.
16709195,0960-7412,Plant J.,2006,10.1111/j.1365-313X.2006.02739.x,,A B-lectin receptor kinase gene conferring rice blast resistance.
18453549,1537-1719,Mol. Biol. Evol.,2008,10.1093/molbev/msn102,,Substitution of the gene for chloroplast RPS16 was assisted by generation of a dual targeting signal.
16730655,0006-291X,Biochem. Biophys. Res. Commun.,2006,10.1016/j.bbrc.2006.04.134,,Characterization of four RecQ homologues from rice (Oryza sativa L. cv. Nipponbare).
16766513,1340-2838,DNA Res.,2006,10.1093/dnares/dsl001,,The rice 14-3-3 gene family and its involvement in responses to biotic and abiotic stress.
19934175,1756-1663,DNA Res.,2010,10.1093/dnares/dsp024,PMC2818186,Discovery of the rpl10 gene in diverse plant mitochondrial genomes and its probable replacement by the nuclear gene for chloroplast RPL10 in two lineages of angiosperms.
20829360,1083-351X,J. Biol. Chem.,2010,10.1074/jbc.M110.121202,PMC2975236,Conserved and novel functions for Arabidopsis thaliana MIA40 in assembly of proteins in mitochondria and peroxisomes.
20840506,1469-8137,New Phytol.,2011,10.1111/j.1469-8137.2010.03459.x,,"OsHMA3, a P1B-type of ATPase affects root-to-shoot cadmium translocation in rice by mediating efflux into vacuoles."
20876334,1460-2431,J. Exp. Bot.,2011,10.1093/jxb/erq290,,"A novel chloroplast protein, CEST induces tolerance to multiple environmental stresses and reduces photooxidative damage in transgenic Arabidopsis."
20944397,1347-6947,Biosci. Biotechnol. Biochem.,2010,10.1271/bbb.100487,,Characterization of a plant-specific gene induced by endoplasmic reticulum stress in Arabidopsis thaliana.
21045556,1559-2324,Plant Signal Behav,2010,,PMC3115230,Subcellular localization of proteins of Oryza sativa L. in the model tobacco and tomato plants.
21330298,1471-9053,Plant Cell Physiol.,2011,10.1093/pcp/pcr019,,"Dual targeting to mitochondria and plastids of AtBT1 and ZmBT1, two members of the mitochondrial carrier family."
19436049,1460-2431,J. Exp. Bot.,2009,10.1093/jxb/erp126,,Subcellular localization and biochemical comparison of cytosolic and secreted cytokinin dehydrogenase enzymes from maize.
22426856,1438-7948,Funct. Integr. Genomics,2012,10.1007/s10142-012-0273-4,,Identification of mitochondrial thiamin diphosphate carriers from Arabidopsis and maize.
23451851,1365-313X,Plant J.,2013,10.1111/tpj.12161,,Embryo defective12 encodes the plastid initiation factor 3 and is essential for embryogenesis in maize.
22486829,1600-0854,Traffic,2012,10.1111/j.1600-0854.2012.01360.x,,"Vacuolar degradation of two integral plasma membrane proteins, AtLRR84A and OsSCAMP1, is cargo ubiquitination-independent and prevacuolar compartment-mediated in plant cells."
23257241,1532-2548,Plant Physiol.,2013,10.1104/pp.112.210997,PMC3561010,"Acquisition, conservation, and loss of dual-targeted proteins in land plants."
23841539,1471-2229,BMC Plant Biol.,2013,10.1186/1471-2229-13-100,PMC3716789,The dual targeting ability of type II NAD(P)H dehydrogenases arose early in land plant evolution.
24704865,1559-2324,Plant Signal Behav,2014,,PMC4091187,Rice nicotianamine synthase localizes to particular vesicles for proper function.
24600457,1664-462X,Front Plant Sci,2014,10.3389/fpls.2014.00037,PMC3928556,Plasma membrane-association of SAUL1-type plant U-box armadillo repeat proteins is conserved in land plants.
24654769,1365-313X,Plant J.,2014,10.1111/tpj.12511,,"OsNIP3;1, a rice boric acid channel, regulates boron distribution and is essential for growth under boron-deficient conditions."
24406791,1532-2548,Plant Physiol.,2014,10.1104/pp.113.233221,PMC3938616,The evolutionary conserved oil body associated protein OBAP1 participates in the regulation of oil body size.
17636130,0027-8424,Proc. Natl. Acad. Sci. U.S.A.,2007,10.1073/pnas.0701180104,PMC1941474,FRET imaging in living maize cells reveals that plasma membrane aquaporins interact to regulate their subcellular localization.
24805883,1573-5028,Plant Mol. Biol.,2014,10.1007/s11103-014-0196-7,,Divergence of the expression and subcellular localization of CCR4-associated factor 1 (CAF1) deadenylase proteins in Oryza sativa.
24926784,1559-2324,Plant Signal Behav,2014,,,Rice acyl-CoA-binding proteins OsACBP4 and OsACBP5 are differentially localized in the endoplasmic reticulum of transgenic Arabidopsis.
23590975,1532-2548,Plant Physiol.,2013,10.1104/pp.113.218081,PMC3668054,Identification of mitochondrial coenzyme a transporters from maize and Arabidopsis.
14657403,0032-0889,Plant Physiol.,2004,10.1104/pp.103.027466,PMC316304,An invertase inhibitor from maize localizes to the embryo surrounding region during early kernel development.
28183294,1471-2229,BMC Plant Biol.,2017,10.1186/s12870-017-0971-0,PMC5301458,Chloroplast proteome response to drought stress and recovery in tomato (Solanum lycopersicum L.).
10937693,0022-0957,J. Exp. Bot.,2000,,,Induced activity of adenine phosphoribosyltransferase (APRT) in iron-deficiency barley roots: a possible role for phytosiderophore production.
11389760,0960-7412,Plant J.,2001,,,"Synthesis, processing and export of cytoplasmic endo-beta-1,4-xylanase from barley aleurone during germination."
11886893,0022-0957,J. Exp. Bot.,2002,,,"IDI7, a new iron-regulated ABC transporter from barley roots, localizes to the tonoplast."
12011350,0032-0889,Plant Physiol.,2002,10.1104/pp.010918,PMC155883,Gibberellin signaling in barley aleurone cells. Control of SLN1 and GAMYB expression.
12581306,0960-7412,Plant J.,2003,,,A role for HvGAMYB in anther development.
12953112,1040-4651,Plant Cell,2003,,PMC181332,"A novel WRKY transcription factor, SUSIBA2, participates in sugar signaling in barley by binding to the sugar-responsive elements of the iso1 promoter."
14617061,0960-7412,Plant J.,2003,,,Functional analysis of barley RAC/ROP G-protein family members in susceptibility to the powdery mildew fungus.
15141952,0894-0282,Mol. Plant Microbe Interact.,2004,10.1094/MPMI.2004.17.5.484,,The barley apoptosis suppressor homologue BAX inhibitor-1 compromises nonhost penetration resistance of barley to the inappropriate pathogen Blumeria graminis f. sp. tritici.
15153196,1399-3054,Physiol Plant,2004,10.1111/j.0031-9317.2004.00325.x,,Isolation of a novel barley cDNA encoding a nuclear protein involved in stress response and leaf senescence.
15347799,0032-0889,Plant Physiol.,2004,10.1104/pp.104.041665,PMC523338,Two transcription factors are negative regulators of gibberellin response in the HvSPY-signaling pathway in barley aleurone.
15604689,0167-4412,Plant Mol. Biol.,2004,10.1007/s11103-004-0906-7,,Hv-WRKY38: a new transcription factor involved in cold- and drought-response in barley.
15821866,0167-4412,Plant Mol. Biol.,2005,10.1007/s11103-004-6520-x,,Transcriptional regulation by abscisic acid in barley (Hordeum vulgare L.) seeds involves autoregulation of the transcription factor HvABI5.
15821867,0167-4412,Plant Mol. Biol.,2005,10.1007/s11103-004-6769-0,,The complex developmental expression of a novel stress-responsive barley Ltp gene is determined by a shortened promoter sequence.
15918880,0960-7412,Plant J.,2005,10.1111/j.1365-313X.2005.02402.x,,"The DOF protein, SAD, interacts with GAMYB in plant nuclei and activates transcription of endosperm-specific genes during barley seed development."
16608452,0028-646X,New Phytol.,2006,10.1111/j.1469-8137.2006.01663.x,,Heavy metal stress and leaf senescence induce the barley gene HvC2d1 encoding a calcium-dependent novel C2 domain-like protein.
16937017,0032-0935,Planta,2007,10.1007/s00425-006-0373-2,,The barley ERF-type transcription factor HvRAF confers enhanced pathogen resistance and salt tolerance in Arabidopsis.
17634181,0032-0781,Plant Cell Physiol.,2007,10.1093/pcp/pcm091,,An aluminum-activated citrate transporter in barley.
18466344,1462-5822,Cell. Microbiol.,2008,10.1111/j.1462-5822.2008.01167.x,,Barley RIC171 interacts with RACB in planta and supports entry of the powdery mildew fungus.
18583533,0032-0889,Plant Physiol.,2008,10.1104/pp.108.120238,PMC2492636,"An abscisic acid-induced protein, HVA22, inhibits gibberellin-mediated programmed cell death in cereal aleurone cells."
18721317,1435-8603,Plant Biol (Stuttg),2008,10.1111/j.1438-8677.2008.00092.x,,Identification and characterization of novel senescence-associated genes from barley (Hordeum vulgare) primary leaves.
18956174,0040-5752,Theor. Appl. Genet.,2009,10.1007/s00122-008-0912-2,,Over-expression of the cell death regulator BAX inhibitor-1 in barley confers reduced or enhanced susceptibility to distinct fungal pathogens.
19759340,1532-2548,Plant Physiol.,2009,10.1104/pp.109.146019,PMC2773090,"Characterization of the entire cystatin gene family in barley and their target cathepsin L-like cysteine-proteases, partners in the hordein mobilization during seed germination."
20176888,1460-2431,J. Exp. Bot.,2010,10.1093/jxb/erq023,PMC2837267,HvALMT1 from barley is involved in the transport of organic anions.
20376676,1432-2048,Planta,2010,10.1007/s00425-010-1155-4,,Characterization of a novel glycinebetaine/proline transporter gene expressed in the mestome sheath and lateral root cap cells in barley.
20473685,1432-2048,Planta,2010,10.1007/s00425-010-1183-0,,Whirly1 in chloroplasts associates with intron containing RNAs and rarely co-localizes with nucleoids.
20507468,1364-3703,Mol. Plant Pathol.,2006,10.1111/j.1364-3703.2006.00359.x,,Transient over-expression of barley BAX Inhibitor-1 weakens oxidative defence and MLA12-mediated resistance to Blumeria graminis f.sp. hordei.
21156329,1618-1328,J. Plant Physiol.,2011,10.1016/j.jplph.2010.11.003,,A soluble acid invertase is directed to the vacuole by a signal anchor mechanism.
21685259,1532-298X,Plant Cell,2011,10.1105/tpc.110.082131,PMC3160019,A barley ROP GTPase ACTIVATING PROTEIN associates with microtubules and regulates entry of the barley powdery mildew fungus into leaf epidermal cells.
22242122,1932-6203,PLoS ONE,2011,10.1371/journal.pone.0029456,PMC3248443,The promoter of the cereal VERNALIZATION1 gene is sufficient for transcriptional induction by prolonged cold.
22415513,1532-2548,Plant Physiol.,2012,10.1104/pp.111.191940,PMC3375967,Barley ROP binding kinase1 is involved in microtubule organization and in basal penetration resistance to the barley powdery mildew fungus.
22773748,1532-298X,Plant Cell,2012,10.1105/tpc.112.097741,PMC3426119,Convergent starvation signals and hormone crosstalk in regulating nutrient mobilization upon germination in cereals.
22958600,1746-4811,Plant Methods,2012,10.1186/1746-4811-8-36,PMC3479045,Barley callus: a model system for bioengineering of starch in cereals.
23720664,1664-462X,Front Plant Sci,2013,10.3389/fpls.2013.00127,PMC3655284,A component of the Sec61 ER protein transporting pore is required for plant susceptibility to powdery mildew.
24033183,1469-8137,New Phytol.,2014,10.1111/nph.12468,,HvZIP7 mediates zinc accumulation in barley (Hordeum vulgare) at moderately high zinc supply.
9465122,0027-8424,Proc. Natl. Acad. Sci. U.S.A.,1998,,PMC19218,Characterization of a calmodulin-binding transporter from the plasma membrane of barley aleurone.
15682463,1615-9853,Proteomics,2005,10.1002/pmic.200401129,,A proteomic approach for investigation of photosynthetic apparatus in plants.
16758444,1615-9853,Proteomics,2006,10.1002/pmic.200500924,,Mapping the proteome of thylakoid membranes by de novo sequencing of intermembrane peptide domains.
17081062,1535-3893,J. Proteome Res.,2006,10.1021/pr0602850,,"Enrichment and identification of integral membrane proteins from barley aleurone layers by reversed-phase chromatography, SDS-PAGE, and LC-MS/MS."
17675669,0021-9258,J. Biol. Chem.,2007,10.1074/jbc.M705132200,,Photosynthetic antenna size in higher plants is controlled by the plastoquinone redox state at the post-transcriptional rather than transcriptional level.
19137553,1615-9861,Proteomics,2009,10.1002/pmic.200800337,,Mass spectrometric characterization of membrane integral low molecular weight proteins from photosystem II in barley etioplasts.
19639596,1615-9861,Proteomics,2009,10.1002/pmic.200800745,,The plasma membrane proteome of germinating barley embryos.
21440687,1876-7737,J Proteomics,2011,10.1016/j.jprot.2011.03.020,,Proteomic comparison of etioplast and chloroplast protein complexes.
24344171,1532-2548,Plant Physiol.,2014,10.1104/pp.113.233163,PMC3912118,"Gibberellic acid-induced aleurone layers responding to heat shock or tunicamycin provide insight into the N-glycoproteome, protein secretion, and endoplasmic reticulum stress."
12481076,0032-0889,Plant Physiol.,2002,10.1104/pp.009803,PMC166704,Proteomics of light-harvesting proteins in different plant species. Analysis and comparison by liquid chromatography-electrospray ionization mass spectrometry. Photosystem I.
19391183,1615-9861,Proteomics,2009,10.1002/pmic.200800806,,Quantitative detection of changes in the leaf-mesophyll tonoplast proteome in dependency of a cadmium exposure of barley (Hordeum vulgare L.) plants.
10664124,0032-0935,Planta,2000,,,Characterization of two cDNA clones encoding isozymes of the F(1)F(0)-ATPase inhibitor protein of rice mitochondria.
10713441,0378-1119,Gene,2000,,,"Rice gibberellin-insensitive gene homolog, OsGAI, encodes a nuclear-localized protein capable of gene activation at transcriptional level."
10805458,0032-0935,Planta,2000,10.1007/s004250050688,,Identification of a signal peptide for oryzacystatin-I.
10831839,0378-1119,Gene,2000,,,Molecular and cellular characterizations of a cDNA clone encoding a novel isozyme of aldehyde dehydrogenase from rice.
10998053,0014-2956,Eur. J. Biochem.,2000,,,"Characterization of RCI-1, a chloroplastic rice lipoxygenase whose synthesis is induced by chemical plant resistance activators."
11166431,1873-2259,Plant Sci.,2001,,,Numerous and highly developed tubular projections from plastids observed in Tobacco epidermal cells.
11337074,1873-2259,Plant Sci.,2001,,,"Chloroplast fructose-1,6-bisphosphatase from Oryza differs in salt tolerance property from the Porteresia enzyme and is protected by osmolytes."
11826299,1040-4651,Plant Cell,2002,,PMC150551,The gibberellin signaling pathway is regulated by the appearance and disappearance of SLENDER RICE1 in nuclei.
11855722,0167-4412,Plant Mol. Biol.,2002,,,"The subcellular localization of an unusual rice calmodulin isoform, OsCaM61, depends on its prenylation status."
12000455,0960-7412,Plant J.,2002,,,OsPNH1 regulates leaf development and maintenance of the shoot apical meristem in rice.
12040100,0032-0781,Plant Cell Physiol.,2002,,,Isolation and characterization of a putative transducer of endoplasmic reticulum stress in Oryza sativa.
12369618,0167-4412,Plant Mol. Biol.,2002,,,"OsARF1, an auxin response factor from rice, is auxin-regulated and classifies as a primary auxin responsive gene."
12376644,0032-0889,Plant Physiol.,2002,10.1104/pp.007781,PMC166606,Inventory and functional characterization of the HAK potassium transporters of rice.
12468735,1040-4651,Plant Cell,2002,,PMC151210,"Abscisic acid-induced transcription is mediated by phosphorylation of an abscisic acid response element binding factor, TRAB1."
12569397,0032-0935,Planta,2003,10.1007/s00425-002-0910-6,,Regulation of biosynthesis and intracellular localization of rice and tobacco homologues of nucleosome assembly protein 1.
12591613,0006-3002,Biochim. Biophys. Acta,2003,,,Identification and characterization of two new members of the GRAS gene family in rice responsive to N-acetylchitooligosaccharide elicitor.
12753582,0960-7412,Plant J.,2003,,,Cell cycle function of a rice B2-type cyclin interacting with a B-type cyclin-dependent kinase.
12913143,0032-0889,Plant Physiol.,2003,,PMC181272,"Hyperphosphorylation of a mitochondrial protein, prohibitin, is induced by calyculin A in a rice lesion-mimic mutant cdr1."
12913152,0032-0889,Plant Physiol.,2003,,PMC181281,"BWMK1, a rice mitogen-activated protein kinase, locates in the nucleus and mediates pathogenesis-related gene expression by activation of a transcription factor."
14535884,0960-7412,Plant J.,2003,,,"Roles of OsCKI1, a rice casein kinase I, in root development and plant hormone sensitivity."
14630954,0032-0889,Plant Physiol.,2003,10.1104/pp.103.022202,PMC300751,Auxin responsiveness of a novel cytochrome p450 in rice coleoptiles.
14657402,0032-0889,Plant Physiol.,2003,10.1104/pp.103.025759,PMC300706,Functional analysis and intracellular localization of rice cryptochromes.
14701929,0032-0781,Plant Cell Physiol.,2003,,,"Molecular and biochemical analyses of OsRab7, a rice Rab7 homolog."
14756772,0960-7412,Plant J.,2004,,,"GID2, an F-box subunit of the SCF E3 complex, specifically interacts with phosphorylated SLR1 protein and regulates the gibberellin-dependent degradation of SLR1 in rice."
14988485,0032-0781,Plant Cell Physiol.,2004,,,"Function, intracellular localization and the importance in salt tolerance of a vacuolar Na(+)/H(+) antiporter from rice."
15047897,0032-0889,Plant Physiol.,2004,10.1104/pp.103.034967,PMC419826,A rice WRKY gene encodes a transcriptional repressor of the gibberellin signaling pathway in aleurone cells.
15215503,0032-0781,Plant Cell Physiol.,2004,,,A novel interaction between calreticulin and ubiquitin-like nuclear protein in rice.
15255870,0960-7412,Plant J.,2004,10.1111/j.1365-313X.2004.02146.x,,OsYSL2 is a rice metal-nicotianamine transporter that is regulated by iron and expressed in the phloem.
15509842,0032-0781,Plant Cell Physiol.,2004,10.1093/pcp/pch133,,Characterization of a rice nuclear-encoded plastid RNA polymerase gene OsRpoTp.
15604716,0167-4412,Plant Mol. Biol.,2004,10.1007/s11103-004-1967-3,,Different subcellular localization and trafficking properties of KNOX class 1 homeodomain proteins from rice.
15604733,0167-4412,Plant Mol. Biol.,2004,10.1007/s11103-004-2648-y,,Ectopic expression of OsYAB1 causes extra stamens and carpels in rice.
15659629,1040-4651,Plant Cell,2005,10.1105/tpc.104.028456,PMC548814,Functional isolation of novel nuclear proteins showing a variety of subnuclear localizations.
15737637,0006-291X,Biochem. Biophys. Res. Commun.,2005,10.1016/j.bbrc.2005.01.161,,The expression of the rice (Oryza sativa L.) homologue of Snm1 is induced by DNA damages.
15792960,0032-0781,Plant Cell Physiol.,2005,10.1093/pcp/pci090,,"RNAi-mediated silencing of OsGEN-L (OsGEN-like), a new member of the RAD2/XPG nuclease family, causes male sterility by defect of microspore development in rice."
15807780,0960-7412,Plant J.,2005,10.1111/j.1365-313X.2005.02367.x,,Roles of isoamylase and ADP-glucose pyrophosphorylase in starch granule synthesis in rice endosperm.
15821023,0032-0781,Plant Cell Physiol.,2005,10.1093/pcp/pci091,,Involvement of alpha-amylase I-1 in starch degradation in rice chloroplasts.
15915636,0894-0282,Mol. Plant Microbe Interact.,2005,10.1094/MPMI-18-0375,,"OsLSD1, a rice zinc finger protein, regulates programmed cell death and callus differentiation."
15939553,0378-1119,Gene,2005,10.1016/j.gene.2005.03.047,,"Characterization of the origin recognition complex (ORC) from a higher plant, rice (Oryza sativa L.)."
15980189,0032-0889,Plant Physiol.,2005,10.1104/pp.105.062703,PMC1176408,A gibberellin-regulated calcineurin B in rice localizes to the tonoplast and is implicated in vacuole function.
15980199,0032-0889,Plant Physiol.,2005,10.1104/pp.105.060509,PMC1176416,Interacting proteins and differences in nuclear transport reveal specific functions for the NAP1 family proteins in plants.
16021404,0167-4412,Plant Mol. Biol.,2005,10.1007/s11103-005-5702-5,,"OsPPR1, a pentatricopeptide repeat protein of rice is essential for the chloroplast biogenesis."
16115061,0960-7412,Plant J.,2005,10.1111/j.1365-313X.2005.02485.x,,"Rice NRR, a negative regulator of disease resistance, interacts with Arabidopsis NPR1 and rice NH1."
16117849,1001-0602,Cell Res.,2005,10.1038/sj.cr.7290329,,"OsWRKY03, a rice transcriptional activator that functions in defense signaling pathway upstream of OsNPR1."
16141453,1040-4651,Plant Cell,2005,10.1105/tpc.105.034090,PMC1242267,Rice Undeveloped Tapetum1 is a major regulator of early tapetum development.
16192280,0021-9258,J. Biol. Chem.,2005,10.1074/jbc.M504616200,,Isolation of a calmodulin-binding transcription factor from rice (Oryza sativa L.).
16193045,1476-4687,Nature,2005,10.1038/nature04028,,GIBBERELLIN INSENSITIVE DWARF1 encodes a soluble receptor for gibberellin.
16263903,0022-0957,J. Exp. Bot.,2005,10.1093/jxb/eri317,,"OsZIP4, a novel zinc-regulated zinc transporter in rice."
16275657,0032-0781,Plant Cell Physiol.,2006,10.1093/pcp/pci227,,"Expression of the vacuolar Ca2+/H+ exchanger, OsCAX1a, in rice: cell and age specificity of expression, and enhancement by Ca2+."
16313672,1471-2121,BMC Cell Biol.,2005,10.1186/1471-2121-6-40,PMC1325227,The peroxisomal multifunctional protein interacts with cortical microtubules in plant cells.
16397796,0032-0935,Planta,2006,10.1007/s00425-005-0214-8,,Rice ascorbate peroxidase gene family encodes functionally diverse isoforms localized in different subcellular compartments.
16412081,0960-7412,Plant J.,2006,10.1111/j.1365-313X.2005.02624.x,,Rice plants take up iron as an Fe3+-phytosiderophore and as Fe2+.
16489123,1040-4651,Plant Cell,2006,10.1105/tpc.105.038240,PMC1383642,Cytoplasmic male sterility of rice with boro II cytoplasm is caused by a cytotoxic peptide and is restored by two related PPR motif genes via distinct modes of mRNA silencing.
16501255,0032-0781,Plant Cell Physiol.,2006,10.1093/pcp/pcj025,,"Functional characterization of OsPPT1, which encodes p-hydroxybenzoate polyprenyltransferase involved in ubiquinone biosynthesis in Oryza sativa."
16531052,0981-9428,Plant Physiol. Biochem.,2006,10.1016/j.plaphy.2005.12.001,,Functional characterization of OsRacB GTPase--a potentially negative regulator of basal disease resistance in rice.
16531481,0032-0889,Plant Physiol.,2006,10.1104/pp.106.078592,PMC1459319,Rice HYDROPEROXIDE LYASES with unique expression patterns generate distinct aldehyde signatures in Arabidopsis.
16552590,0032-0935,Planta,2006,10.1007/s00425-006-0251-y,,"Structure, expression, and functional analysis of the hexokinase gene family in rice (Oryza sativa L.)."
16905871,1341-7568,Genes Genet. Syst.,2006,,,"Two OsGASR genes, rice GAST homologue genes that are abundant in proliferating tissues, show different expression patterns in developing panicles."
16919842,0176-1617,J. Plant Physiol.,2007,10.1016/j.jplph.2006.07.006,,"OsWRKY71, a rice transcription factor, is involved in rice defense response."
16971692,0737-4038,Mol. Biol. Evol.,2006,10.1093/molbev/msl112,,Evidence for transit peptide acquisition through duplication and subsequent frameshift mutation of a preexisting protein gene in rice.
16977424,0167-4412,Plant Mol. Biol.,2007,10.1007/s11103-006-9079-x,,A rice dehydration-inducible SNF1-related protein kinase 2 phosphorylates an abscisic acid responsive element-binding factor and associates with ABA signaling.
16990291,0032-0781,Plant Cell Physiol.,2006,10.1093/pcp/pcl013,,Rice Immature Pollen 1 (RIP1) is a regulator of late pollen development.
17028208,1040-4651,Plant Cell,2006,10.1105/tpc.105.039891,PMC1626603,Rice plastidial N-glycosylated nucleotide pyrophosphatase/phosphodiesterase is transported from the ER-golgi to the chloroplast through the secretory pathway.
17048141,1435-8603,Plant Biol (Stuttg),2007,10.1055/s-2006-924561,,"GER1, a GDSL motif-encoding gene from rice is a novel early light- and jasmonate-induced gene."
17086397,0032-0935,Planta,2007,10.1007/s00425-006-0430-x,,Genes for alkaline/neutral invertase in rice: alkaline/neutral invertases are located in plant mitochondria and also in plastids.
17144896,0960-7412,Plant J.,2007,10.1111/j.1365-313X.2006.02941.x,,The rice heterochronic gene SUPERNUMERARY BRACT regulates the transition from spikelet meristem to floral meristem.
17148693,0032-0781,Plant Cell Physiol.,2007,10.1093/pcp/pcl050,,"Two novel nuclear genes, OsSIG5 and OsSIG6, encoding potential plastid sigma factors of RNA polymerase in rice: tissue-specific and light-responsive gene expression."
