pmid,issn,name,year,doi,pmcid,title
22136599,1365-313X,Plant J.,2012,10.1111/j.1365-313X.2011.04872.x,,"Aberrant spikelet and panicle1, encoding a TOPLESS-related transcriptional co-repressor, is involved in the regulation of meristem fate in rice."
22158700,1532-2548,Plant Physiol.,2012,10.1104/pp.111.191379,PMC3271775,A CCCH-type zinc finger nucleic acid-binding protein quantitatively confers resistance against rice bacterial blight disease.
22161313,1559-0305,Mol. Biotechnol.,2012,10.1007/s12033-011-9477-4,,"ENAC1, a NAC transcription factor, is an early and transient response regulator induced by abiotic stress in rice (Oryza sativa L.)."
22189955,1432-2048,Planta,2012,10.1007/s00425-011-1564-z,,bZIP transcription factor OsbZIP52/RISBZ5: a potential negative regulator of cold and drought stress response in rice.
22201023,1573-4978,Mol. Biol. Rep.,2012,10.1007/s11033-011-1399-5,,"Molecular cloning and characterization of OsUPS, a U-box containing E3 ligase gene that respond to phosphate starvation in rice (Oryza sativa)."
22228180,0219-1032,Mol. Cells,2012,10.1007/s10059-012-2165-9,PMC3887722,Activation of rice Yellow Stripe1-Like 16 (OsYSL16) enhances iron efficiency.
22353560,1744-7909,J Integr Plant Biol,2012,10.1111/j.1744-7909.2012.01094.x,,A mutation of OSOTP 51 leads to impairment of photosystem I complex assembly and serious photo-damage in rice.
22378946,1460-2431,J. Exp. Bot.,2012,10.1093/jxb/ers051,PMC3350935,Identification and evaluation of -3 fatty acid desaturase genes for hyperfortifying -linolenic acid in transgenic rice seed.
22409537,1365-313X,Plant J.,2012,10.1111/j.1365-313X.2012.04989.x,,Rice LGD1 containing RNA binding activity affects growth and development through alternative promoters.
22413771,1365-313X,Plant J.,2012,10.1111/j.1365-313X.2012.04995.x,,The photoprotective protein PsbS exerts control over CO(2) assimilation rate in fluctuating light in rice.
22419106,1432-2242,Theor. Appl. Genet.,2012,10.1007/s00122-012-1840-8,,A novel gene IBF1 is required for the inhibition of brown pigment deposition in rice hull furrows.
22442415,1460-2431,J. Exp. Bot.,2012,10.1093/jxb/ers079,PMC3388842,The rice ERF transcription factor OsERF922 negatively regulates resistance to Magnaporthe oryzae and salt tolerance.
22451723,1460-2431,J. Exp. Bot.,2012,10.1093/jxb/ers098,PMC3398448,Modulation of ethylene responses by OsRTH1 overexpression reveals the biological significance of ethylene in rice seedling growth and development.
22548273,1365-3040,Plant Cell Environ.,2012,10.1111/j.1365-3040.2012.02527.x,,The OsHMA2 transporter is involved in root-to-shoot translocation of Zn and Cd in rice.
22616023,2041-2851,AoB Plants,2012,10.1093/aobpla/pls011,PMC3357053,Transcription factor OsHsfC1b regulates salt tolerance and development in Oryza sativa ssp. japonica.
22644768,1432-2048,Planta,2012,10.1007/s00425-012-1667-1,,"Molecular cloning and characterization of OsCHR4, a rice chromatin-remodeling factor required for early chloroplast development in adaxial mesophyll."
22665444,1532-2548,Plant Physiol.,2012,10.1104/pp.112.195529,PMC3425189,Brittle culm15 encodes a membrane-associated chitinase-like protein required for cellulose biosynthesis in rice.
22676236,1365-3040,Plant Cell Environ.,2013,10.1111/j.1365-3040.2012.02553.x,,Involvement of ASR genes in aluminium tolerance mechanisms in rice.
22747551,1365-313X,Plant J.,2012,10.1111/j.1365-313X.2012.05091.x,,Rice MPR25 encodes a pentatricopeptide repeat protein and is essential for RNA editing of nad5 transcripts in mitochondria.
22788523,1365-313X,Plant J.,2012,10.1111/j.1365-313X.2012.05106.x,,"Lack of the Golgi phosphate transporter PHT4;6 causes strong developmental defects, constitutively activated disease resistance mechanisms and altered intracellular phosphate compartmentation in Arabidopsis."
22829206,1573-5028,Plant Mol. Biol.,2012,10.1007/s11103-012-9945-7,,RNAi knockdown of rice SE5 gene is sensitive to the herbicide methyl viologen by the down-regulation of antioxidant defense.
22840326,1618-1328,J. Plant Physiol.,2012,10.1016/j.jplph.2012.06.010,,Hsp90 binds microtubules and is involved in the reorganization of the microtubular network in angiosperms.
22882529,1365-313X,Plant J.,2012,10.1111/j.1365-313X.2012.05121.x,,The putative auxin efflux carrier OsPIN3t is involved in the drought stress response and drought tolerance.
22882555,missing-issn,,,,,
22902685,1559-2324,Plant Signal Behav,2012,10.4161/psb.21662,PMC3493409,The rice ASR5 protein: a putative role in the response to aluminum photosynthesis disturbance.
22921006,1873-2259,Plant Sci.,2012,10.1016/j.plantsci.2012.06.006,,Overexpression of OsTLP27 in rice improves chloroplast function and photochemical efficiency.
22956125,1432-2048,Planta,2013,10.1007/s00425-012-1736-5,,SUI-family genes encode phosphatidylserine synthases and regulate stem development in rice.
22984070,1095-9203,Science,2012,10.1126/science.1223702,,A killer-protector system regulates both hybrid sterility and segregation distortion in rice.
22990444,1559-2324,Plant Signal Behav,2012,10.4161/psb.22086,PMC3548864,Intracellular localization and physiological function of a rice Ca-permeable channel OsTPC1.
23053539,1432-2048,Planta,2013,10.1007/s00425-012-1756-1,,"Young Leaf Chlorosis 1, a chloroplast-localized gene required for chlorophyll and lutein accumulation during early leaf development in rice."
23061987,1438-8677,Plant Biol (Stuttg),2013,10.1111/j.1438-8677.2012.00664.x,,A salicylic acid-induced rice (Oryza sativa L.) transcription factor OsWRKY77 is involved in disease resistance of Arabidopsis thaliana.
23083684,1618-1328,J. Plant Physiol.,2013,10.1016/j.jplph.2012.08.019,,"Overexpression of OrbHLH001, a putative helix-loop-helix transcription factor, causes increased expression of AKT1 and maintains ionic balance under salt stress in rice."
23122787,1618-1328,J. Plant Physiol.,2013,10.1016/j.jplph.2012.09.007,,"Differential subcellular localization, enzymatic properties and expression patterns of -aminobutyric acid transaminases (GABA-Ts) in rice (Oryza sativa)."
23192363,1432-203X,Plant Cell Rep.,2013,10.1007/s00299-012-1372-3,,Accumulation of rice prolamin-GFP fusion proteins induces ER-derived protein bodies in transgenic rice calli.
23220939,1752-9867,Mol Plant,2013,10.1093/mp/sss145,,The role of OsMSH5 in crossover formation during rice meiosis.
23233223,1869-1889,Sci China Life Sci,2012,10.1007/s11427-012-4414-8,,"Overexpression of OsDPR, a novel rice gene highly expressed under iron deficiency, suppresses plant growth."
23263792,1532-2548,Plant Physiol.,2013,10.1104/pp.112.210948,PMC3561011,Rice glycosyltransferase1 encodes a glycosyltransferase essential for pollen wall formation.
23296688,1532-2548,Plant Physiol.,2013,10.1104/pp.112.205385,PMC3585590,"OsTZF1, a CCCH-tandem zinc finger protein, confers delayed senescence and stress tolerance in rice by regulating stress-related genes."
23462973,1573-5028,Plant Mol. Biol.,2013,10.1007/s11103-013-0032-5,,"OsWRKY28, a PAMP-responsive transrepressor, negatively regulates innate immune responses in rice against rice blast fungus."
23485991,1422-0067,Int J Mol Sci,2013,10.3390/ijms14035899,PMC3634459,"A Rice Immunophilin Gene, OsFKBP16-3, Confers Tolerance to Environmental Stress in Arabidopsis and Rice."
23602899,1090-2104,Biochem. Biophys. Res. Commun.,2013,10.1016/j.bbrc.2013.04.014,,Rice Rab11 is required for JA-mediated defense signaling.
23620301,0219-1032,Mol. Cells,2013,10.1007/s10059-013-2337-2,PMC3887859,"OsCpn601, encoding the plastid chaperonin 60 subunit, is essential for folding of rbcL."
23629832,1532-2548,Plant Physiol.,2013,10.1104/pp.113.216044,PMC3668076,"MULTI-FLORET SPIKELET1, which encodes an AP2/ERF protein, determines spikelet meristem fate and sterile lemma identity in rice."
23698632,1460-2431,J. Exp. Bot.,2013,10.1093/jxb/ert143,PMC3741691,"The rice RING finger E3 ligase, OsHCI1, drives nuclear export of multiple substrate proteins and its heterogeneous overexpression enhances acquired thermotolerance."
23700971,1365-3040,Plant Cell Environ.,2014,10.1111/pce.12138,,"Expression in Arabidopsis and cellular localization reveal involvement of rice NRAMP, OsNRAMP1, in arsenic transport and tolerance."
23741473,1932-6203,PLoS ONE,2013,10.1371/journal.pone.0065139,PMC3669293,Rice OsGL1-6 is involved in leaf cuticular wax accumulation and drought resistance.
23783412,1573-5028,Plant Mol. Biol.,2013,10.1007/s11103-013-0095-3,,Identification and characterization of a novel chloroplast/mitochondria co-localized glutathione reductase 3 involved in salt stress response in rice.
23849113,1873-2259,Plant Sci.,2013,10.1016/j.plantsci.2013.05.003,,The endoplasmic reticulum-quality control component SDF2 is essential for XA21-mediated immunity in rice.
23849131,1873-2259,Plant Sci.,2013,10.1016/j.plantsci.2013.06.003,,Mutation of OsDET1 increases chlorophyll content in rice.
23886623,1532-2548,Plant Physiol.,2013,10.1104/pp.113.217547,PMC3762635,Abscisic acid- and stress-induced highly proline-rich glycoproteins regulate root growth in rice.
23888867,1365-313X,Plant J.,2013,10.1111/tpj.12296,,A plasma membrane-localized small peptide is involved in rice aluminum tolerance.
23894405,1932-6203,PLoS ONE,2013,10.1371/journal.pone.0069046,PMC3718813,RNAi-directed downregulation of vacuolar H(+) -ATPase subunit a results in enhanced stomatal aperture and density in rice.
23926064,1471-9053,Plant Cell Physiol.,2013,10.1093/pcp/pct112,,Expression and functional analysis of the CorA-MRS2-ALR-type magnesium transporter family in rice.
23963678,1460-2431,J. Exp. Bot.,2013,10.1093/jxb/ert243,PMC3808320,"Mn tolerance in rice is mediated by MTP8.1, a member of the cation diffusion facilitator family."
24043853,1460-2431,J. Exp. Bot.,2013,10.1093/jxb/ert298,PMC3830488,WRKY76 is a rice transcriptional repressor playing opposite roles in blast disease resistance and cold stress tolerance.
24064929,1532-2548,Plant Physiol.,2013,10.1104/pp.113.226225,PMC3813655,A member of the heavy metal P-type ATPase OsHMA5 is involved in xylem loading of copper in rice.
24089432,1471-9053,Plant Cell Physiol.,2013,10.1093/pcp/pct122,,Identification of transcription factors involved in rice secondary cell wall formation.
24128296,1365-313X,Plant J.,2013,10.1111/tpj.12352,,"OsACA6, a P-type IIB Ca ATPase promotes salinity and drought stress tolerance in tobacco by ROS scavenging and enhancing the expression of stress-responsive genes."
24151203,1471-9053,Plant Cell Physiol.,2014,10.1093/pcp/pct149,,A mutable albino allele in rice reveals that formation of thylakoid membranes requires the SNOW-WHITE LEAF1 gene.
24153418,1460-2431,J. Exp. Bot.,2013,10.1093/jxb/ert312,PMC3871807,Analysis of rice ER-resident J-proteins reveals diversity and functional differentiation of the ER-resident Hsp70 system in plants.
24251791,1365-313X,Plant J.,2014,10.1111/tpj.12383,,"Nicotianamine synthase 2 localizes to the vesicles of iron-deficient rice roots, and its mutation in the YXX or LL motif causes the disruption of vesicle formation or movement in rice."
24280027,1939-8425,Rice (N Y),2013,10.1186/1939-8433-6-24,PMC4883695,A point mutation in the zinc finger motif of RID1/EHD2/OsID1 protein leads to outstanding yield-related traits in japonica rice variety Wuyunjing 7.
24286292,1742-4658,FEBS J.,2014,10.1111/febs.12656,,Genome-wide expressional and functional analysis of calcium transport elements during abiotic stress and development in rice.
24320692,1365-313X,Plant J.,2014,10.1111/tpj.12405,,"SMALL GRAIN 1, which encodes a mitogen-activated protein kinase kinase 4, influences grain size in rice."
24335509,1532-2548,Plant Physiol.,2014,10.1104/pp.113.229591,PMC3912094,Amyloplast-localized SUBSTANDARD STARCH GRAIN4 protein influences the size of starch grains in rice endosperm.
24401104,1744-7909,J Integr Plant Biol,2014,10.1111/jipb.12125,,Two hydroxypyruvate reductases encoded by OsHPR1 and OsHPR2 are involved in photorespiratory metabolism in rice.
24475234,1932-6203,PLoS ONE,2014,10.1371/journal.pone.0087110,PMC3903634,"OsGA2ox5, a gibberellin metabolism enzyme, is involved in plant growth, the root gravity response and salt stress."
24738983,1469-8137,New Phytol.,2014,10.1111/nph.12809,,Subcellular localization of rice acyl-CoA-binding proteins (ACBPs) indicates that OsACBP6::GFP is targeted to the peroxisomes.
24784760,1532-2548,Plant Physiol.,2014,10.1104/pp.113.230268,PMC4044838,Overexpression of a Calcium-Dependent Protein Kinase Confers Salt and Drought Tolerance in Rice by Preventing Membrane Lipid Peroxidation.
24802508,1932-6203,PLoS ONE,2014,10.1371/journal.pone.0096712,PMC4011751,Recombinant expression and characterization of the cytoplasmic rice -glucosidase Os1BGlu4.
24964058,0894-0282,Mol. Plant Microbe Interact.,2014,10.1094/MPMI-03-14-0068-R,,Targeted gene disruption of OsCERK1 reveals its indispensable role in chitin perception and involvement in the peptidoglycan response and immunity in rice.
24977183,1537-744X,ScientificWorldJournal,2014,10.1155/2014/178038,PMC3995101,CMYB1 encoding a MYB transcriptional activator is involved in abiotic stress and circadian rhythm in rice.
25041515,1365-313X,Plant J.,2014,10.1111/tpj.12614,,"RCN1/OsABCG5, an ATP-binding cassette (ABC) transporter, is required for hypodermal suberization of roots in rice (Oryza sativa)."
25081037,0219-1032,Mol. Cells,2014,10.14348/molcells.2014.0128,PMC4132305,OsWRKY42 represses OsMT1d and induces reactive oxygen species and leaf senescence in rice.
25089296,1537-744X,ScientificWorldJournal,2014,10.1155/2014/809353,PMC4095735,"OsSLI1, a homeodomain containing transcription activator, involves abscisic acid related stress response in rice (Oryza sativa L.)."
25103875,1469-8137,New Phytol.,2014,10.1111/nph.12986,PMC4232926,Identification and functional assay of the interaction motifs in the partner protein OsNAR2.1 of the two-component system for high-affinity nitrate transport.
25138437,1432-203X,Plant Cell Rep.,2014,10.1007/s00299-014-1666-8,PMC4197380,OsABCG15 encodes a membrane protein that plays an important role in anther cuticle and pollen exine formation in rice.
25316064,1460-2431,J. Exp. Bot.,2015,10.1093/jxb/eru405,,Identification and characterization of chloroplast casein kinase II from Oryza sativa (rice).
25327517,1365-313X,Plant J.,2015,10.1111/tpj.12705,,Rice SNF2 family helicase ENL1 is essential for syncytial endosperm development.
9193078,0960-7412,Plant J.,1997,,,"Expression of a betaine aldehyde dehydrogenase gene in rice, a glycinebetaine nonaccumulator, and possible localization of its protein in peroxisomes."
12746528,0032-0889,Plant Physiol.,2003,10.1104/pp.102.018986,PMC166968,Towards an analysis of the rice mitochondrial proteome.
15069638,1617-4615,Mol. Genet. Genomics,2004,10.1007/s00438-004-1002-z,,Proteomics of the rice cell: systematic identification of the protein populations in subcellular compartments.
15258153,0021-9258,J. Biol. Chem.,2004,10.1074/jbc.M406015200,,Changes in the mitochondrial proteome during the anoxia to air transition in rice focus around cytochrome-containing respiratory complexes.
15276429,0031-9422,Phytochemistry,2004,10.1016/j.phytochem.2004.04.012,,Rice proteomics: recent developments and analysis of nuclear proteins.
15276442,0031-9422,Phytochemistry,2004,10.1016/j.phytochem.2004.04.007,,Identification of oxidised proteins in the matrix of rice leaf mitochondria by immunoprecipitation and two-dimensional liquid chromatography-tandem mass spectrometry.
16429260,0167-4412,Plant Mol. Biol.,2006,10.1007/s11103-005-3688-7,,Ordered assembly of mitochondria during rice germination begins with pro-mitochondrial structures rich in components of the protein import apparatus.
16443157,0891-5849,Free Radic. Biol. Med.,2006,10.1016/j.freeradbiomed.2005.08.036,,Protein oxidation in plant mitochondria detected as oxidized tryptophan.
17189339,0032-0889,Plant Physiol.,2007,10.1104/pp.106.090738,PMC1803725,Proteome dynamics during plastid differentiation in rice.
18372294,1471-9053,Plant Cell Physiol.,2008,10.1093/pcp/pcn049,,Nano scale proteomics revealed the presence of regulatory proteins including three FT-Like proteins in phloem and xylem saps from rice.
18557835,1365-313X,Plant J.,2008,10.1111/j.1365-313X.2008.03578.x,,A proteomic and phosphoproteomic analysis of Oryza sativa plasma membrane and vacuolar membrane.
19010998,0032-0889,Plant Physiol.,2009,10.1104/pp.108.131300,PMC2633852,"Experimental analysis of the rice mitochondrial proteome, its biogenesis, and heterogeneity."
19038476,1618-1328,J. Plant Physiol.,2009,10.1016/j.jplph.2008.09.010,,Proteomics of weakly bound cell wall proteins in rice calli.
19217306,1873-2690,Plant Physiol. Biochem.,2009,10.1016/j.plaphy.2008.12.021,,Mitochondrial proteome during salt stress-induced programmed cell death in rice.
19226311,1399-3054,Physiol Plant,2009,10.1111/j.1399-3054.2008.01198.x,,Proteomic analysis of the secretome of rice calli.
19621931,1535-3893,J. Proteome Res.,2009,10.1021/pr900187e,,Application of rice nuclear proteome analysis to the identification of evolutionarily conserved and glucose-responsive nuclear proteins.
19685898,1535-3907,J. Proteome Res.,2009,10.1021/pr900537p,,Proteomic analysis of cytoskeleton-associated RNA binding proteins in developing rice seed.
19924544,1573-5028,Plant Mol. Biol.,2010,10.1007/s11103-009-9573-z,,Functional and composition differences between mitochondrial complex II in Arabidopsis and rice are correlated with the complex genetic history of the enzyme.
20720170,1532-2548,Plant Physiol.,2010,10.1104/pp.110.162214,PMC2948988,Analysis of the rice mitochondrial carrier family reveals anaerobic accumulation of a basic amino acid carrier involved in arginine metabolism during seed germination.
21347307,1932-6203,PLoS ONE,2011,10.1371/journal.pone.0016723,PMC3037377,Comparative proteomics analysis of the root apoplasts of rice seedlings in response to hydrogen peroxide.
21433289,1615-9861,Proteomics,2011,10.1002/pmic.201000703,,Integrated proteome and metabolite analysis of the de-etiolation process in plastids from rice (Oryza sativa L.).
23027867,1083-351X,J. Biol. Chem.,2012,10.1074/jbc.M112.382549,PMC3501019,Alterations of mitochondrial protein assembly and jasmonic acid biosynthesis pathway in Honglian (HL)-type cytoplasmic male sterility rice.
23159799,1876-7737,J Proteomics,2013,10.1016/j.jprot.2012.10.029,,In-depth insight into in vivo apoplastic secretome of rice-Magnaporthe oryzae interaction.
23303719,1615-9861,Proteomics,2013,10.1002/pmic.201100416,,Identification of centromeric and telomeric DNA-binding proteins in rice.
23356873,1469-8137,New Phytol.,2013,10.1111/nph.12123,,Differential induction of mitochondrial machinery by light intensity correlates with changes in respiratory metabolism and photorespiration in rice leaves.
23777608,1477-5956,Proteome Sci,2013,10.1186/1477-5956-11-26,PMC3695858,Nuclear proteome response to cell wall removal in rice (Oryza sativa).
24083427,1535-3907,J. Proteome Res.,2013,10.1021/pr400614n,,Effect of phosphorus levels on the protein profiles of secreted protein and root surface protein of rice.
18022940,1615-9853,Proteomics,2007,10.1002/pmic.200700580,,Proteome and phosphoproteome analysis of chromatin associated proteins in rice (Oryza sativa).
18203134,0173-0835,Electrophoresis,2008,10.1002/elps.200700412,,Removal of high-abundance proteins for nuclear subproteome studies in rice (Oryza sativa) endosperm.
19253284,1615-9861,Proteomics,2009,10.1002/pmic.200800589,,Secretome analysis of differentially induced proteins in rice suspension-cultured cells triggered by rice blast fungus and elicitor.
23128297,1876-7737,J Proteomics,2013,10.1016/j.jprot.2012.10.021,,Identification of glycosyltransferases involved in cell wall synthesis of wheat endosperm.
24136528,1940-6029,Methods Mol. Biol.,2014,10.1007/978-1-62703-631-3_19,,Modifications of wheat germ cell-free system for functional proteomics of plant membrane proteins.
23683508,1618-1328,J. Plant Physiol.,2013,10.1016/j.jplph.2013.03.016,,Comparative analysis of the chloroplast proteomes of a wheat (Triticum aestivum L.) single seed descent line and its parents.
23895732,1535-3907,J. Proteome Res.,2013,10.1021/pr400504a,,Investigating the role of respiration in plant salinity tolerance by analyzing mitochondrial proteomes from wheat and a salinity-tolerant Amphiploid (wheat  Lophopyrum elongatum).
22160430,1573-4978,Mol. Biol. Rep.,2012,10.1007/s11033-011-1302-4,,Towards an understanding of wheat chloroplasts: a methodical investigation of thylakoid proteome.
22736107,1573-4978,Mol. Biol. Rep.,2012,10.1007/s11033-012-1777-7,,Changes in physiology and protein abundance in salt-stressed wheat chloroplasts.
22056444,1347-6947,Biosci. Biotechnol. Biochem.,2011,10.1271/bbb.110479,,A systematic strategy for proteomic analysis of chloroplast protein complexes in wheat.
19786127,0006-3002,Biochim. Biophys. Acta,2010,10.1016/j.bbapap.2009.09.023,,Cell wall proteome of wheat roots under flooding stress using gel-based and LC MS/MS-based proteomics approaches.
20410318,1460-2431,J. Exp. Bot.,2010,10.1093/jxb/erq101,PMC2882262,The physiological importance of photosynthetic ferredoxin NADP+ oxidoreductase (FNR) isoforms in wheat.
21043471,1535-3907,J. Proteome Res.,2010,10.1021/pr1007834,,Wheat mitochondrial proteomes provide new links between antioxidant defense and plant salinity tolerance.
19643044,1976-6696,BMB Rep,2009,,,Proteome analysis of chloroplast proteins in stage albinism line of winter wheat (triticum aestivum) FA85.
18071923,0166-8595,Photosyn. Res.,2008,10.1007/s11120-007-9281-y,,Proteomic analysis of highly purified prolamellar bodies reveals their significance in chloroplast development.
18419817,1471-2229,BMC Plant Biol.,2008,10.1186/1471-2229-8-39,PMC2383896,Metabolic pathways of the wheat (Triticum aestivum) endosperm amyloplast revealed by proteomics.
16595579,0022-0957,J. Exp. Bot.,2006,10.1093/jxb/erj156,,Proteome of amyloplasts isolated from developing wheat endosperm presents evidence of broad metabolic capability.
16481623,0027-8424,Proc. Natl. Acad. Sci. U.S.A.,2006,10.1073/pnas.0511040103,PMC1413819,A complete ferredoxin/thioredoxin system regulates fundamental processes in amyloplasts.
22527397,1471-2970,"Philos. Trans. R. Soc. Lond., B, Biol. Sci.",2012,10.1098/rstb.2011.0238,PMC3321688,"Molecular interactions of ROOTLESS CONCERNING CROWN AND SEMINAL ROOTS, a LOB domain protein regulating shoot-borne root initiation in maize (Zea mays L.)."
18622732,0167-4412,Plant Mol. Biol.,2008,10.1007/s11103-008-9373-x,,The expression pattern of plasma membrane aquaporins in maize leaf highlights their role in hydraulic regulation.
14671024,1040-4651,Plant Cell,2004,10.1105/tpc.017194,PMC301406,Interactions between plasma membrane aquaporins modulate their water channel activity.
11029706,0960-7412,Plant J.,2000,,,"Maize ROP7 GTPase contains a unique, CaaX box-independent plasma membrane targeting signal."
19201915,0032-0889,Plant Physiol.,2009,10.1104/pp.108.130146,PMC2633859,Advancing cell biology and functional genomics in maize using fluorescent protein-tagged lines.
17105995,1355-8382,RNA,2007,10.1261/rna.139607,PMC1705760,The CRM domain: an RNA binding module derived from an ancient ribosome-associated protein.
22199372,1471-9053,Plant Cell Physiol.,2012,10.1093/pcp/pcr183,,Insights into Maize LEA proteins: from proteomics to functional approaches.
12121449,0960-7412,Plant J.,2002,,,A nucleus-encoded maize protein with sigma factor activity accumulates in mitochondria and chloroplasts.
20040499,1477-9129,Development,2010,10.1242/dev.035964,,"DiSUMO-like DSUL is required for nuclei positioning, cell specification and viability during female gametophyte maturation in maize."
16709191,0960-7412,Plant J.,2006,10.1111/j.1365-313X.2006.02742.x,,Maize DBF1-interactor protein 1 containing an R3H domain is a potential regulator of DBF1 activity in stress responses.
12856940,0167-4412,Plant Mol. Biol.,2003,,,Molecular characterization of His-Asp phosphorelay signaling factors in maize leaves: implications of the signal divergence by cytokinin-inducible response regulators in the cytosol and the nuclei.
18682426,1471-9053,Plant Cell Physiol.,2008,10.1093/pcp/pcn112,,Maize plasma membrane aquaporins belonging to the PIP1 and PIP2 subgroups are in vivo phosphorylated.
18430213,1471-2229,BMC Plant Biol.,2008,10.1186/1471-2229-8-44,PMC2395261,Characterisation of the tryptophan synthase alpha subunit in maize.
15604678,0167-4412,Plant Mol. Biol.,2004,10.1007/s11103-004-0553-z,,"Interaction of maize Opaque-2 and the transcriptional co-activators GCN5 and ADA2, in the modulation of transcriptional activity."
22307781,1573-4978,Mol. Biol. Rep.,2012,10.1007/s11033-012-1453-y,,Cloning and characterization of the stress-induced bZIP gene ZmbZIP60 from maize.
12913155,0032-0889,Plant Physiol.,2003,,PMC181284,Three nicotianamine synthase genes isolated from maize are differentially regulated by iron nutritional status.
18218975,0032-0889,Plant Physiol.,2008,10.1104/pp.107.109553,PMC2259071,"Characterization of the monoterpene synthase gene tps26, the ortholog of a gene induced by insect herbivory in maize."
10929132,0960-7412,Plant J.,2000,,,DNA-interactions and nuclear localisation of the chromosomal HMG domain protein SSRP1 from maize.
23175742,1532-298X,Plant Cell,2012,10.1105/tpc.112.104125,PMC3531853,Identification of PAN2 by quantitative proteomics as a leucine-rich repeat-receptor-like kinase acting upstream of PAN1 to polarize cell division in maize.
25341533,1532-2548,Plant Physiol.,2014,10.1104/pp.114.247486,PMC4256885,The maize DWARF1 encodes a gibberellin 3-oxidase and is dual localized to the nucleus and cytosol.
