pmid,issn,name,year,doi,pmcid,title
24817160,1471-9053,Plant Cell Physiol.,2014,10.1093/pcp/pcu054,,"A novel maize homeodomain-leucine zipper (HD-Zip) I gene, Zmhdz10, positively regulates drought and salt tolerance in both rice and Arabidopsis."
24985738,1744-7909,J Integr Plant Biol,2015,10.1111/jipb.12234,,A putative plant organelle RNA recognition protein gene is essential for maize kernel development.
17933905,1040-4651,Plant Cell,2007,10.1105/tpc.106.048868,PMC2174714,Subcellular localization and functional domain studies of DEFECTIVE KERNEL1 in maize and Arabidopsis suggest a model for aleurone cell fate specification involving CRINKLY4 and SUPERNUMERARY ALEURONE LAYER1.
15840644,0032-0781,Plant Cell Physiol.,2005,10.1093/pcp/pci108,,NADP-malic enzyme and Hsp70: co-purification of both proteins and modification of NADP-malic enzyme properties by association with Hsp70.
25203637,1932-6203,PLoS ONE,2014,10.1371/journal.pone.0107346,PMC4159291,"Diversity of stability, localization, interaction and control of downstream gene activity in the Maize Aux/IAA protein family."
24092882,1471-9053,Plant Cell Physiol.,2013,10.1093/pcp/pct142,,Maize membrane-bound transcription factor Zmbzip17 is a key regulator in the cross-talk of ER quality control and ABA signaling.
24025774,1476-4687,Nature,2013,10.1038/nature12583,,The maize G gene COMPACT PLANT2 functions in CLAVATA signalling to control shoot meristem size.
11230568,0032-0781,Plant Cell Physiol.,2001,,,Transcriptional expression characteristics and subcellular localization of ADP-glucose pyrophosphorylase in the oil plant Perilla frutescens.
22291199,1532-2548,Plant Physiol.,2012,10.1104/pp.111.189241,PMC3320169,The maize tapetum employs diverse mechanisms to synthesize and store proteins and flavonoids and transfer them to the pollen surface.
17259266,1040-4651,Plant Cell,2007,10.1105/tpc.105.039594,PMC1820960,empty pericarp4 encodes a mitochondrion-targeted pentatricopeptide repeat protein necessary for seed development and plant growth in maize.
23543751,1471-9053,Plant Cell Physiol.,2013,10.1093/pcp/pct047,,"ZmLEA3, a multifunctional group 3 LEA protein from maize (Zea mays L.), is involved in biotic and abiotic stresses."
22440334,1618-1328,J. Plant Physiol.,2012,10.1016/j.jplph.2011.12.020,,Characterization and expression analysis of six MADS-box genes in maize (Zea mays L.).
18550681,0032-0889,Plant Physiol.,2008,10.1104/pp.108.121541,PMC2492655,The Relationship between auxin transport and maize branching.
11641280,0890-9369,Genes Dev.,2001,10.1101/gad.208501,PMC312812,The fasciated ear2 gene encodes a leucine-rich repeat receptor-like protein that regulates shoot meristem proliferation in maize.
19450586,1873-3468,FEBS Lett.,2009,10.1016/j.febslet.2009.05.022,,Maize AKINbetagamma dimerizes through the KIS/CBM domain and assembles into SnRK1 complexes.
16362327,0032-0935,Planta,2006,10.1007/s00425-005-0179-7,,"ZmLrk-1, a receptor-like kinase induced by fungal infection in germinating seeds."
10330475,1040-4651,Plant Cell,1999,,PMC144232,Functional analysis of two maize cDNAs encoding T7-like RNA polymerases.
10330467,1040-4651,Plant Cell,1999,,PMC144225,Three-dimensional microscopy of the Rad51 recombination protein during meiotic prophase.
20532241,1545-7885,PLoS Biol.,2010,10.1371/journal.pbio.1000388,PMC2879413,Defensin-like ZmES4 mediates pollen tube burst in maize via opening of the potassium channel KZM1.
24089437,1532-2548,Plant Physiol.,2013,10.1104/pp.113.227314,PMC3813652,"Maize LAZY1 mediates shoot gravitropism and inflorescence development through regulating auxin transport, auxin signaling, and light response."
18688729,0167-4412,Plant Mol. Biol.,2008,10.1007/s11103-008-9382-9,,Significant improvement of stress tolerance in tobacco plants by overexpressing a stress-responsive aldehyde dehydrogenase gene from maize (Zea mays).
20829359,1083-351X,J. Biol. Chem.,2010,10.1074/jbc.M110.116285,PMC2975188,Relevant elements of a maize gamma-zein domain involved in protein body biogenesis.
21638061,1432-203X,Plant Cell Rep.,2011,10.1007/s00299-011-1077-z,,Cloning and characterization of a maize SnRK2 protein kinase gene confers enhanced salt tolerance in transgenic Arabidopsis.
10889237,0032-0889,Plant Physiol.,2000,,PMC59051,Complementary expression of two plastid-localized sigma-like factors in maize.
21789193,1932-6203,PLoS ONE,2011,10.1371/journal.pone.0021909,PMC3137599,Role of plant-specific N-terminal domain of maize CK21 subunit in CK2 functions and holoenzyme regulation.
22654889,1664-462X,Front Plant Sci,2012,10.3389/fpls.2012.00101,PMC3360202,Evolution and expression of tandem duplicated maize flavonol synthase genes.
21190064,1573-5028,Plant Mol. Biol.,2011,10.1007/s11103-010-9723-3,,Recognition of A. thaliana centromeres by heterologous CENH3 requires high similarity to the endogenous protein.
18392626,0721-7714,Plant Cell Rep.,2008,10.1007/s00299-008-0542-9,,Dual targeting of organellar seryl-tRNA synthetase to maize mitochondria and chloroplasts.
22915319,1573-5028,Plant Mol. Biol.,2012,10.1007/s11103-012-9951-9,,"Cellular localization of the embryo-specific hybrid PRP from Zea mays, and characterization of promoter regulatory elements of its gene."
12096094,0022-0957,J. Exp. Bot.,2002,,,Esr proteins are secreted by the cells of the embryo surrounding region.
23911729,1873-2690,Plant Physiol. Biochem.,2013,10.1016/j.plaphy.2013.07.004,,"A maize calcium-dependent protein kinase gene, ZmCPK4, positively regulated abscisic acid signaling and enhanced drought stress tolerance in transgenic Arabidopsis."
18923021,0032-0889,Plant Physiol.,2009,10.1104/pp.108.130971,PMC2613742,"Tie-dyed1 encodes a novel, phloem-expressed transmembrane protein that functions in carbohydrate partitioning."
17882422,0721-7714,Plant Cell Rep.,2008,10.1007/s00299-007-0447-z,,Calreticulin mRNA and protein are localized to protein bodies in storage maize callus cells.
10504570,0960-7412,Plant J.,1999,,,Maize calreticulin localizes preferentially to plasmodesmata in root apex.
11874098,0962-8819,Transgenic Res.,2002,,,Expression of the high capacity calcium-binding domain of calreticulin increases bioavailable calcium stores in plants.
17022830,1471-2229,BMC Plant Biol.,2006,10.1186/1471-2229-6-22,PMC1609167,The PTI1-like kinase ZmPti1a from maize (Zea mays L.) co-localizes with callose at the plasma membrane of pollen and facilitates a competitive advantage to the male gametophyte.
24268164,1873-2259,Plant Sci.,2014,10.1016/j.plantsci.2013.09.014,,"ZmMKK1, a novel group A mitogen-activated protein kinase kinase gene in maize, conferred chilling stress tolerance and was involved in pathogen defense in transgenic tobacco."
12750468,0027-8424,Proc. Natl. Acad. Sci. U.S.A.,2003,10.1073/pnas.1132113100,PMC164533,Conservation and molecular dissection of ROUGH SHEATH2 and ASYMMETRIC LEAVES1 function in leaf development.
22662764,1557-7430,DNA Cell Biol.,2012,10.1089/dna.2011.1514,PMC3378959,Maize histone H2B-mCherry: a new fluorescent chromatin marker for somatic and meiotic chromosome research.
23455933,1438-7948,Funct. Integr. Genomics,2013,10.1007/s10142-013-0315-6,,Nicotianamine synthase gene family as central components in heavy metal and phytohormone response in maize.
16243905,1040-4651,Plant Cell,2005,10.1105/tpc.105.035519,PMC1276033,Functional differentiation of bundle sheath and mesophyll maize chloroplasts determined by comparative proteomics.
16281185,1615-9853,Proteomics,2005,10.1002/pmic.200500047,,Pathogen elicitor-induced changes in the maize extracellular matrix proteome.
16377746,0032-0889,Plant Physiol.,2006,10.1104/pp.105.070219,PMC1326053,Cell wall proteome in the maize primary root elongation zone. I. Extraction and identification of water-soluble and lightly ionically bound proteins.
16602704,1535-3893,J. Proteome Res.,2006,10.1021/pr050471q,,Characterization of the maize xylem sap proteome.
18258693,0032-0889,Plant Physiol.,2008,10.1104/pp.107.113423,PMC2287327,Deregulation of maize C4 photosynthetic development in a mesophyll cell-defective mutant.
18453340,1535-9484,Mol. Cell Proteomics,2008,10.1074/mcp.M800016-MCP200,PMC2556027,Consequences of C4 differentiation for chloroplast membrane proteomes in maize mesophyll and bundle sheath cells.
18521681,0098-0331,J. Chem. Ecol.,2008,10.1007/s10886-008-9477-4,,Protein expression changes in maize roots in response to humic substances.
18599648,0032-0889,Plant Physiol.,2008,10.1104/pp.108.121012,PMC2528119,Comparative proteomics of chloroplast envelopes from C3 and C4 plants reveals specific adaptations of the plastid envelope to C4 photosynthesis and candidate proteins required for maintaining C4 metabolite fluxes.
20089766,1532-2548,Plant Physiol.,2010,10.1104/pp.109.152694,PMC2832236,"Reconstruction of metabolic pathways, protein expression, and homeostasis machineries across maize bundle sheath and mesophyll chloroplasts: large-scale quantitative proteomics using the first maize genome assembly."
20701693,1438-8677,Plant Biol (Stuttg),2010,10.1111/j.1438-8677.2009.00280.x,,Characterisation of Zea mays L. plastidial transglutaminase: interactions with thylakoid membrane proteins.
21196305,1945-0508,Front Biosci (Elite Ed),2011,,,Shotgun proteomics analysis on maize chloroplast thylakoid membrane.
22065420,1532-2548,Plant Physiol.,2012,10.1104/pp.111.188474,PMC3252073,Nucleoid-enriched proteomes in developing plastids and chloroplasts from maize leaves: a new conceptual framework for nucleoid functions.
22192489,1746-4811,Plant Methods,2011,10.1186/1746-4811-7-48,PMC3284877,Comparative evaluation of extraction methods for apoplastic proteins from maize leaves.
22501030,1744-7909,J Integr Plant Biol,2012,10.1111/j.1744-7909.2012.01122.x,,Nitrogen under- and over-supply induces distinct protein responses in maize xylem sap.
22607058,1365-313X,Plant J.,2012,10.1111/j.1365-313X.2012.05056.x,,Specific changes in total and mitochondrial proteomes are associated with higher levels of heterosis in maize hybrids.
22833285,1615-9861,Proteomics,2012,10.1002/pmic.201200196,,Differential phosphorylation of thylakoid proteins in mesophyll and bundle sheath chloroplasts from maize plants grown under low or high light.
23198870,1535-3907,J. Proteome Res.,2013,10.1021/pr300952g,,Construction of plastid reference proteomes for maize and Arabidopsis and evaluation of their orthologous relationships; the concept of orthoproteomics.
23353019,1876-7737,J Proteomics,2013,10.1016/j.jprot.2013.01.006,,The plasma membrane proteome of maize roots grown under low and high iron conditions.
23508561,1664-462X,Front Plant Sci,2013,10.3389/fpls.2013.00033,PMC3589600,Developmental distribution of the plasma membrane-enriched proteome in the maize primary root growth zone.
23543921,1664-462X,Front Plant Sci,2013,10.3389/fpls.2013.00065,PMC3610082,Comparative proteomics of chloroplasts envelopes from bundle sheath and mesophyll chloroplasts reveals novel membrane proteins with a possible role in c4-related metabolite fluxes and development.
24677780,1615-9861,Proteomics,2014,10.1002/pmic.201300147,,Maize (Zea mays L.) seedling leaf nuclear proteome and differentially expressed proteins between a hybrid and its parental lines.
20408568,1535-3907,J. Proteome Res.,2010,10.1021/pr901168v,,The mucilage proteome of maize (Zea mays L.) primary roots.
14966246,0032-0889,Plant Physiol.,2004,10.1104/pp.103.032003,PMC344533,A proteomic analysis of maize chloroplast biogenesis.
24351685,1532-2548,Plant Physiol.,2014,10.1104/pp.113.229054,PMC3912095,The potato tuber mitochondrial proteome.
24773703,1471-2164,BMC Genomics,2014,10.1186/1471-2164-15-315,PMC4234511,Proteomics and transcriptomics of the BABA-induced resistance response in potato using a novel functional annotation approach.
25270759,1471-2229,BMC Plant Biol.,2014,10.1186/s12870-014-0254-y,PMC4192290,Phosphite-induced changes of the transcriptome and secretome in Solanum tuberosum leading to resistance against Phytophthora infestans.
22313117,1535-3907,J. Proteome Res.,2012,10.1021/pr201004k,,Protein profiling in potato (Solanum tuberosum L.) leaf tissues by differential centrifugation.
22902798,1873-2690,Plant Physiol. Biochem.,2012,10.1016/j.plaphy.2012.07.017,,Hydrophobic proteins secreted into the apoplast may contribute to resistance against Phytophthora infestans in potato.
26455813,1876-7737,J Proteomics,2016,10.1016/j.jprot.2015.10.009,,The membrane proteome of male gametophyte in Solanum lycopersicum.
26471654,0308-8146,Food Chem,2016,10.1016/j.foodchem.2015.08.055,,Mitochondrial ascorbate-glutathione cycle and proteomic analysis of carbonylated proteins during tomato (Solanum lycopersicum) fruit ripening.
26371478,1932-6203,PLoS ONE,2015,10.1371/journal.pone.0137266,PMC4570674,Plastid Proteomic Analysis in Tomato Fruit Development.
26583031,1664-462X,Front Plant Sci,2015,10.3389/fpls.2015.00967,PMC4631825,The effector repertoire of Fusarium oxysporum determines the tomato xylem proteome composition following infection.
25431925,1422-0067,Int J Mol Sci,2014,10.3390/ijms151221803,PMC4284679,Physiological and proteomic analysis in chloroplasts of Solanum lycopersicum L. under silicon efficiency and salinity stress.
25464976,1474-760X,Genome Biol.,2014,10.1186/s13059-014-0548-2,PMC4269173,Tomato nuclear proteome reveals the involvement of specific E2 ubiquitin-conjugating enzymes in fruit ripening.
22892874,1618-0860,J. Plant Res.,2013,10.1007/s10265-012-0516-4,,Proteomic analysis of tomato (Solanum lycopersicum) secretome.
22364583,1535-3907,J. Proteome Res.,2012,10.1021/pr200965c,PMC4874510,Proteomic analysis of ripening tomato fruit infected by Botrytis cinerea.
22908117,1532-2548,Plant Physiol.,2012,10.1104/pp.112.203679,PMC3461550,Proteomic analysis of chloroplast-to-chromoplast transition in tomato reveals metabolic shifts coupled with disrupted thylakoid biogenesis machinery and elevated energy-production components.
28394025,1469-8137,New Phytol.,2017,10.1111/nph.14540,PMC5637918,Quantitative analysis of the tomato nuclear proteome during Phytophthora capsici infection unveils regulators of immunity.
20496099,1573-5028,Plant Mol. Biol.,2010,10.1007/s11103-010-9646-z,PMC3128696,Analysis of cell wall proteins regulated in stem of susceptible and resistant tomato species after inoculation with Ralstonia solanacearum: a proteomic approach.
27689984,1420-3049,Molecules,2016,10.3390/molecules21101300,,Flavonoid Interaction with a Chitinase from Grape Berry Skin: Protein Identification and Modulation of the Enzymatic Activity.
23391302,1471-2229,BMC Plant Biol.,2013,10.1186/1471-2229-13-24,PMC3640900,Large-scale proteomic analysis of the grapevine leaf apoplastic fluid reveals mainly stress-related proteins and cell wall modifying enzymes.
27224218,1535-3907,J. Proteome Res.,2016,10.1021/acs.jproteome.6b00190,,Gel-Free/Label-Free Proteomic Analysis of Endoplasmic Reticulum Proteins in Soybean Root Tips under Flooding and Drought Stresses.
27291164,1535-3907,J. Proteome Res.,2016,10.1021/acs.jproteome.6b00330,,Nuclear Proteomics Reveals the Role of Protein Synthesis and Chromatin Structure in Root Tip of Soybean during the Initial Stage of Flooding Stress.
27780359,1535-3907,J. Proteome Res.,2016,10.1021/acs.jproteome.6b00572,,Insights into the Response of Soybean Mitochondrial Proteins to Various Sizes of Aluminum Oxide Nanoparticles under Flooding Stress.
21107622,1438-2199,Amino Acids,2012,10.1007/s00726-010-0809-7,,Differential responses of microsomal proteins and metabolites in two contrasting cadmium (Cd)-accumulating soybean cultivars under Cd stress.
22945350,1615-9861,Proteomics,2012,10.1002/pmic.201100629,,Comparative analyses of three legume species reveals conserved and unique root extracellular proteins.
23041469,1876-7737,J Proteomics,2012,10.1016/j.jprot.2012.09.032,,Comprehensive analysis of endoplasmic reticulum-enriched fraction in root tips of soybean under flooding stress using proteomics techniques.
21132161,1742-2051,Mol Biosyst,2011,10.1039/c0mb00171f,,Nuclear proteomic changes linked to soybean rust resistance.
21246215,1432-2048,Planta,2011,10.1007/s00425-011-1352-9,,Protein and metabolite composition of xylem sap from field-grown soybeans (Glycine max).
21766870,1535-3907,J. Proteome Res.,2011,10.1021/pr2001918,,Comprehensive analysis of mitochondria in roots and hypocotyls of soybean under flooding stress using proteomics and metabolomics techniques.
19658398,1535-3907,J. Proteome Res.,2009,10.1021/pr9002883,,Analysis of plasma membrane proteome in soybean and application to flooding stress response.
20443193,1615-9861,Proteomics,2010,10.1002/pmic.201000180,,Ozone stress-induced proteomic changes in leaf total soluble and chloroplast proteins of soybean reveal that carbon allocation is involved in adaptation in the early developmental stage.
20458513,1438-2199,Amino Acids,2010,10.1007/s00726-010-0608-1,,Comparative proteomics analysis of differentially expressed proteins in soybean cell wall during flooding stress.
20209511,1615-9861,Proteomics,2010,10.1002/pmic.200900632,,Comparative analysis of soybean plasma membrane proteins under osmotic stress using gel-based and LC MS/MS-based proteomics approaches.
18757068,0031-9422,Phytochemistry,2008,10.1016/j.phytochem.2008.07.004,,Proteomic analysis of soybean nodule cytosol.
19073762,1040-4651,Plant Cell,2008,10.1105/tpc.108.062877,PMC2630451,Proteomic identification and characterization of a novel peroxisomal adenine nucleotide transporter supplying ATP for fatty acid beta-oxidation in soybean and Arabidopsis.
19772575,1471-2229,BMC Plant Biol.,2009,10.1186/1471-2229-9-119,PMC2758885,Distinct changes in soybean xylem sap proteome in response to pathogenic and symbiotic microbe interactions.
20203239,1471-9053,Plant Cell Physiol.,2010,10.1093/pcp/pcq024,,"Analysis of the Rac/Rop small GTPase family in rice: expression, subcellular localization and role in disease resistance."
18784285,0032-0889,Plant Physiol.,2008,10.1104/pp.108.123356,PMC2577279,XA27 depends on an amino-terminal signal-anchor-like sequence to localize to the apoplast for resistance to Xanthomonas oryzae pv oryzae.
19938377,1559-2324,Plant Signal Behav,2009,,PMC2802814,Evidence for a role of hexokinases as conserved glucose sensors in both monocot and dicot plant species.
23820081,1879-0038,Gene,2013,10.1016/j.gene.2013.06.037,,Expression of antimicrobial peptides thanatin(S) in transgenic Arabidopsis enhanced resistance to phytopathogenic fungi and bacteria.
24714629,1559-2324,Plant Signal Behav,2014,,PMC4091560,Traffic jam on the cellular secretory pathway generated by a replication protein from a plant RNA virus.
8246886,0026-8925,Mol. Gen. Genet.,1993,,,Functional expression of the transcriptional activator Opaque-2 of Zea mays in transformed yeast.
11891300,0027-8424,Proc. Natl. Acad. Sci. U.S.A.,2002,10.1073/pnas.052484099,PMC122655,Intercellular trafficking of a KNOTTED1 green fluorescent protein fusion in the leaf and shoot meristem of Arabidopsis.
12937943,0721-7714,Plant Cell Rep.,2003,10.1007/s00299-003-0693-7,,Jellyfish green fluorescent protein as a useful reporter for transient expression and stable transformation in Medicago sativa L.
12900451,0950-1991,Development,2003,,,Developmental regulation and significance of KNOX protein trafficking in Arabidopsis.
15001699,0032-0889,Plant Physiol.,2004,10.1104/pp.103.030577,PMC389931,The MADS box transcription factor ZmMADS2 is required for anther and pollen maturation in maize and accumulates in apoptotic bodies during anther dehiscence.
15681383,1095-9203,Science,2005,10.1126/science.1104954,,Micropylar pollen tube guidance by egg apparatus 1 of maize.
16460507,0960-7412,Plant J.,2006,10.1111/j.1365-313X.2005.02632.x,,Divergence of duplicated genes in maize: evolution of contrasting targeting information for enzymes in the porphyrin pathway.
21778179,1460-2431,J. Exp. Bot.,2011,10.1093/jxb/err220,PMC3193018,Ligand-binding properties and subcellular localization of maize cytokinin receptors.
21653193,1532-298X,Plant Cell,2011,10.1105/tpc.111.085597,PMC3160025,ROP GTPases act with the receptor-like protein PAN1 to polarize asymmetric cell division in maize.
22706447,1532-2548,Plant Physiol.,2012,10.1104/pp.112.199737,PMC3425180,Reliable transient transformation of intact maize leaf cells for functional genomics and experimental study.
